{
    "$schema": "http://json-schema.org/draft-07/schema#",
    "$id": "PLACEHOLDER",
    "title": "Film",
    "description": "A character in the Marvel Cinematic Universe",
    "type": "object",
    "properties": {
        "name": {
            "type": "string",
            "description": "The name of the character"
        },
        "alter-ego": {
            "type": "string",
            "description": "The alternate/superhero name of the character"
        },
        "actors": {
            "type": "array",
            "description": "The actor(s) that have portrayed the character",
            "items": {
                "type": "string"
            }
        },
        "id": {
            "type": "integer",
            "description": "The unique identifier/index of the film"
        },
        "films" : {
            "type": "array",
            "description": "The id's of the films in which the character has appeared",
            "items": {
                "type": "integer"
            }
        }
    },
    "required": [
        "name",
        "alter-ego",
        "actors",
        "id",
        "films"
    ]
}

